{
  "$schema": "https://json-schema.org/draft/2020-12/schema",
  "title": "location",
  "type": "object",
  "properties": {
    "id": {
      "type": "string",
      "minLength": 1,
      "maxLength": 80,
      "pattern": "^[A-Za-z][A-Za-z0-9_.-]*$"
    },
    "name": {
      "type": "string",
      "minLength": 1,
      "maxLength": 100
    },
    "stage": {
      "enum": [
        "early",
        "middle",
        "late"
      ]
    },
    "tags": {
      "type": "array",
      "items": {
        "type": "string",
        "minLength": 1,
        "maxLength": 80,
        "pattern": "^[A-Za-z][A-Za-z0-9_.-]*$"
      },
      "minItems": 1,
      "maxItems": 30
    },
    "fromTags": {
      "type": "array",
      "items": {
        "type": "string",
        "minLength": 1,
        "maxLength": 80,
        "pattern": "^[A-Za-z][A-Za-z0-9_.-]*$"
      },
      "minItems": 0,
      "maxItems": 30
    },
    "after": {
      "type": "array",
      "items": {
        "type": "string",
        "minLength": 1,
        "maxLength": 80,
        "pattern": "^[A-Za-z][A-Za-z0-9_.-]*$"
      },
      "minItems": 0,
      "maxItems": 128
    },
    "required": {
      "type": "boolean"
    },
    "weight": {
      "type": "integer",
      "minimum": 1,
      "maximum": 1000
    },
    "enabled": {
      "type": "boolean"
    }
  },
  "required": [
    "id",
    "name",
    "stage",
    "tags",
    "fromTags",
    "after",
    "required",
    "weight"
  ],
  "additionalProperties": false
}
